{
  "$schema": "https://json-schema.org/draft/2020-12/schema",
  "$id": "https://raw.githubusercontent.com/TristinOrg/SceneReplay/v0.1.0/Packages/com.scenereplay.schema/Documentation~/Schemas/scenereplay.shape-1.0.schema.json",
  "title": "SceneReplay Shape Definition 1.0",
  "description": "An engine-agnostic procedural model hierarchy.",
  "type": "object",
  "additionalProperties": false,
  "required": ["schema", "name", "style", "root"],
  "properties": {
    "schema": { "const": "scenereplay.shape/1.0" },
    "name": { "type": "string", "minLength": 1 },
    "style": { "type": "string" },
    "rig": { "$ref": "#/$defs/rig" },
    "root": { "$ref": "#/$defs/node" }
  },
  "$defs": {
    "finiteNumber": { "type": "number" },
    "rig": {
      "type": "object",
      "additionalProperties": false,
      "required": ["type", "joints"],
      "properties": {
        "type": { "type": "string", "minLength": 1 },
        "joints": {
          "type": "array",
          "items": { "$ref": "#/$defs/rigJoint" }
        }
      }
    },
    "rigJoint": {
      "type": "object",
      "additionalProperties": false,
      "required": ["role", "nodeId"],
      "properties": {
        "role": { "type": "string", "minLength": 1 },
        "nodeId": { "type": "string", "minLength": 1 },
        "rotationConstraint": { "$ref": "#/$defs/rotationConstraint" }
      }
    },
    "rotationConstraint": {
      "type": "object",
      "additionalProperties": false,
      "required": ["minimum", "maximum"],
      "properties": {
        "minimum": { "$ref": "#/$defs/vector3" },
        "maximum": { "$ref": "#/$defs/vector3" }
      }
    },
    "vector2": {
      "type": "object",
      "additionalProperties": false,
      "required": ["x", "y"],
      "properties": {
        "x": { "$ref": "#/$defs/finiteNumber" },
        "y": { "$ref": "#/$defs/finiteNumber" }
      }
    },
    "vector3": {
      "type": "object",
      "additionalProperties": false,
      "required": ["x", "y", "z"],
      "properties": {
        "x": { "$ref": "#/$defs/finiteNumber" },
        "y": { "$ref": "#/$defs/finiteNumber" },
        "z": { "$ref": "#/$defs/finiteNumber" }
      }
    },
    "color": {
      "type": "object",
      "additionalProperties": false,
      "required": ["r", "g", "b", "a"],
      "properties": {
        "r": { "type": "number", "minimum": 0, "maximum": 1 },
        "g": { "type": "number", "minimum": 0, "maximum": 1 },
        "b": { "type": "number", "minimum": 0, "maximum": 1 },
        "a": { "type": "number", "minimum": 0, "maximum": 1 }
      }
    },
    "transform": {
      "type": "object",
      "additionalProperties": false,
      "required": ["position", "eulerAngles", "scale"],
      "properties": {
        "position": { "$ref": "#/$defs/vector3" },
        "eulerAngles": { "$ref": "#/$defs/vector3" },
        "scale": { "$ref": "#/$defs/vector3" }
      }
    },
    "appearance": {
      "type": "object",
      "additionalProperties": false,
      "required": ["colorRole", "hasColorOverride", "color"],
      "properties": {
        "colorRole": { "type": "string" },
        "hasColorOverride": { "type": "boolean" },
        "color": { "$ref": "#/$defs/color" }
      }
    },
    "profileSection": {
      "type": "object",
      "additionalProperties": false,
      "required": ["z", "scale", "offset"],
      "properties": {
        "z": { "$ref": "#/$defs/finiteNumber" },
        "scale": { "$ref": "#/$defs/vector2" },
        "offset": { "$ref": "#/$defs/vector2" }
      }
    },
    "profileCageSection": {
      "type": "object",
      "additionalProperties": false,
      "required": ["z", "profile"],
      "properties": {
        "z": { "$ref": "#/$defs/finiteNumber" },
        "profile": {
          "type": "array",
          "minItems": 3,
          "items": { "$ref": "#/$defs/vector2" }
        }
      }
    },
    "node": {
      "type": "object",
      "additionalProperties": false,
      "required": ["id", "name", "type", "transform", "appearance", "children"],
      "properties": {
        "id": { "type": "string", "minLength": 1 },
        "name": { "type": "string", "minLength": 1 },
        "type": { "type": "string", "pattern": "^[a-z0-9][a-z0-9._-]*/[a-z0-9][a-z0-9._-]*$" },
        "transform": { "$ref": "#/$defs/transform" },
        "appearance": { "$ref": "#/$defs/appearance" },
        "mirrorAxis": { "enum": ["x", "y", "z"] },
        "parameters": {
          "type": "object",
          "additionalProperties": { "$ref": "#/$defs/finiteNumber" }
        },
        "profile": {
          "type": "array",
          "items": { "$ref": "#/$defs/vector2" }
        },
        "path": {
          "type": "array",
          "items": { "$ref": "#/$defs/vector3" }
        },
        "profileSections": {
          "type": "array",
          "items": { "$ref": "#/$defs/profileSection" }
        },
        "profileCageSections": {
          "type": "array",
          "items": { "$ref": "#/$defs/profileCageSection" }
        },
        "children": {
          "type": "array",
          "items": { "$ref": "#/$defs/node" }
        }
      }
    }
  }
}
