{
  "schema": "scenereplay.shape/1.0",
  "name": "Minimal Shape",
  "style": "example/default",
  "root": {
    "id": "model",
    "name": "Model",
    "type": "core/group",
    "transform": {
      "position": { "x": 0, "y": 0, "z": 0 },
      "eulerAngles": { "x": 0, "y": 0, "z": 0 },
      "scale": { "x": 1, "y": 1, "z": 1 }
    },
    "appearance": {
      "colorRole": "",
      "hasColorOverride": false,
      "color": { "r": 1, "g": 1, "b": 1, "a": 1 }
    },
    "children": []
  }
}
